{
  "$schema": "https://json-schema.org/draft/2020-12/schema",
  "$id": "https://gatelm.local/schemas/tenant-chat/v1/completion-sse-event.schema.json",
  "title": "Tenant Chat completion SSE data event",
  "type": "object",
  "additionalProperties": false,
  "required": ["type", "schemaVersion", "requestId", "turnId", "sequence"],
  "properties": {
    "type": {
      "type": "string",
      "enum": ["tenant_chat.delta", "tenant_chat.final"]
    },
    "schemaVersion": { "const": 1 },
    "requestId": { "$ref": "#/$defs/opaqueId" },
    "turnId": { "$ref": "#/$defs/opaqueId" },
    "sequence": { "type": "integer", "minimum": 1 },
    "delta": { "type": "string", "minLength": 1, "maxLength": 16384 },
    "terminalOutcome": {
      "type": "string",
      "enum": ["succeeded", "failed", "cancelled", "cache_hit", "quota_blocked", "budget_blocked"]
    },
    "effectiveModelKey": {
      "type": ["string", "null"],
      "minLength": 1,
      "maxLength": 200,
      "pattern": "^[A-Za-z0-9][A-Za-z0-9._:/-]{0,199}$"
    },
    "usage": { "$ref": "#/$defs/usage" },
    "quotaState": { "$ref": "#/$defs/policyState" },
    "budgetState": { "$ref": "#/$defs/policyState" },
    "cacheOutcome": {
      "type": "string",
      "enum": ["off", "hit", "miss"]
    },
    "replayed": { "type": "boolean" },
    "error": { "$ref": "#/$defs/error" }
  },
  "allOf": [
    {
      "if": {
        "properties": { "type": { "const": "tenant_chat.delta" } },
        "required": ["type"]
      },
      "then": {
        "required": ["delta"],
        "not": {
          "anyOf": [
            { "required": ["terminalOutcome"] },
            { "required": ["usage"] },
            { "required": ["error"] }
          ]
        }
      }
    },
    {
      "if": {
        "properties": { "type": { "const": "tenant_chat.final" } },
        "required": ["type"]
      },
      "then": {
        "required": [
          "terminalOutcome",
          "effectiveModelKey",
          "usage",
          "quotaState",
          "budgetState",
          "cacheOutcome",
          "replayed"
        ],
        "not": { "required": ["delta"] }
      }
    }
  ],
  "$defs": {
    "opaqueId": {
      "type": "string",
      "minLength": 1,
      "maxLength": 128,
      "pattern": "^[A-Za-z0-9_-]+$"
    },
    "policyState": {
      "type": "string",
      "enum": ["normal", "warning", "economy", "blocked"]
    },
    "usage": {
      "type": "object",
      "additionalProperties": false,
      "required": ["inputTokens", "outputTokens", "totalTokens", "usageQuality"],
      "properties": {
        "inputTokens": { "type": "integer", "minimum": 0 },
        "outputTokens": { "type": "integer", "minimum": 0 },
        "totalTokens": { "type": "integer", "minimum": 0 },
        "usageQuality": {
          "type": "string",
          "enum": ["confirmed", "pending_unconfirmed", "not_available"]
        }
      }
    },
    "error": {
      "type": "object",
      "additionalProperties": false,
      "required": ["code", "message"],
      "properties": {
        "code": { "type": "string", "minLength": 1, "maxLength": 64 },
        "message": { "type": "string", "minLength": 1, "maxLength": 256 },
        "retryAfterSeconds": { "type": "integer", "minimum": 1, "maximum": 300 }
      }
    }
  }
}
